{"chapter_id":"ch-06","source":"chapters/06-yang-mills-asd.qmd","central_question":"位相数はどうエネルギー下限と一次方程式を選ぶのか。","reader_starting_state":"曲率の自己双対分解とChern-Weil chargeの規約を理解している。","prerequisites":["not-A","not-F","not-split","conv-asd","conv-charge","conv-ym"],"new_concepts":[],"main_derivations":["Yang-Mills energy identity","ASDからYang-Mills方程式","BPST instantonのscale挙動"],"results":["thm-energy"],"proof_depth":"A","black_boxes":[],"rigor_statuses":["theorem","proposition","heuristic"],"reader_stop_points":[{"question":"ASDとYang-Mills方程式は同じか。","resolution":"body","location":"ASDならYang--Mills、逆は違う"},{"question":"符号規約を変えると何が変わるか。","resolution":"body","location":"位相数がenergyの床になる"}],"required_bridges":["Hodge分解からenergy identityへ","ASD解集合からgauge quotientへ"],"figures":[],"sources":["src-dk"],"previous_connection":"第5章の和と差の二式を曲率へ適用する。","next_question":"ASD解のgauge冗長性を除いた空間はどう局所化されるのか。","unresolved_stop_points":[]}
