{"chapter_id":"ch-01","source":"chapters/01-smooth-structures.qmd","central_question":"smooth構造の違いを何で観測するのか。","reader_starting_state":"線形代数、微積分、基礎的な微分方程式を学んでいる。多様体、局所座標、同相写像、微分同相写像は未習でよい。","prerequisites":["assump-base"],"new_concepts":["not-X"],"main_derivations":["smooth invariantによる識別論理","moduli不変量生成機械の全体像"],"results":[],"proof_depth":"B","black_boxes":[],"rigor_statuses":["definition","proposition"],"reader_stop_points":[{"question":"非平滑化可能性と異種滑らかな構造は同じか。","resolution":"body","location":"地図だけでは微分できない"},{"question":"なぜ4次元へ限定するのか。","resolution":"body","location":"なぜ4次元だけが難しいのか"}],"required_bridges":["分類問題から観測量へ","smooth invariantから交点形式へ"],"figures":["fig-coordinate-overlap","fig-category"],"sources":[],"previous_connection":"教材の中心問題と圏の区別を設定する。","next_question":"4次元の位相的入力として交点形式はなぜ中心になるのか。","unresolved_stop_points":[]}
