{"chapter_id":"ch-12","source":"chapters/12-invariant-machine.qmd","central_question":"補助計量に依存するmoduliから不変な数をどう作るのか。","reader_starting_state":"orientationとUhlenbeck compactificationの必要性を理解している。","prerequisites":["not-M","not-bplus","assump-invariance","assump-wall","conv-dimension"],"new_concepts":[],"main_derivations":["0次元符号付きcount","parameterized moduliの境界式","mu-mapによる正次元pairing"],"results":["thm-uhlenbeck"],"proof_depth":"C","black_boxes":["bb-uhlenbeck"],"rigor_statuses":["theorem","proposition"],"reader_stop_points":[{"question":"compactnessなしでcountは不変か。","resolution":"body","location":"計量依存性をcobordismへ変える"},{"question":"b_2^+=1で何が変わるか。","resolution":"body","location":"b_2^+>1の役割"}],"required_bridges":["compactificationから符号付きcountへ","一般機械からDonaldsonの出力へ"],"figures":[],"sources":["src-dk","src-fu"],"previous_connection":"第11章のideal境界をparameterized moduliの境界解析へ使う。","next_question":"同じASD機械はどの異なるsmooth情報を出力するのか。","unresolved_stop_points":[]}
