{"chapter_id":"ch-11","source":"chapters/11-bubbling.qmd","central_question":"解列が逃げるとき何が失われ何が量子化されて残るのか。","reader_starting_state":"ASD moduliの局所smoothnessと4次元energyのscale invarianceを理解している。","prerequisites":["not-M","conv-charge","conv-ym","assump-base"],"new_concepts":[],"main_derivations":["曲率測度の原子極限","small-energy gaugeの役割","Uhlenbeck compactificationのstrata"],"results":["thm-uhlenbeck"],"proof_depth":"C","black_boxes":["bb-uhlenbeck"],"rigor_statuses":["theorem","black_box_theorem","heuristic"],"reader_stop_points":[{"question":"energy boundだけで強収束するか。","resolution":"body","location":"有界energyだけでは強収束しない"},{"question":"失われたenergyはなぜ整数単位か。","resolution":"black_box","location":"曲率測度の極限"}],"required_bridges":["scale invarianceからbubblingへ","compactificationからcobordismへ"],"figures":["fig-bubbling"],"sources":["src-fu"],"previous_connection":"第10章の局所moduliを大域的に閉じる問題へ進む。","next_question":"compactified moduliから補助データに依存しない数をどう取るのか。","unresolved_stop_points":[]}
