{"chapter_id":"ch-13","source":"chapters/13-donaldson-outputs.qmd","central_question":"対角化定理と多項式不変量は何が同じで何が違うのか。","reader_starting_state":"moduliから符号付きcountとコホモロジー・ペアリングを作る一般機械を理解している。","prerequisites":["not-Q","not-M","assump-donaldson","assump-invariance"],"new_concepts":["not-donaldson-invariant"],"main_derivations":["対角化定理の入力出力","mu-mapとDonaldson polynomial","二出力の比較","K3 knot surgeryによる実在例への接続"],"results":["thm-donaldson-diagonalization","thm-donaldson-polynomial","thm-knot-surgery"],"proof_depth":"C","black_boxes":["bb-uhlenbeck","bb-knot-surgery"],"rigor_statuses":["theorem","black_box_theorem"],"reader_stop_points":[{"question":"対角化定理と多項式は同じ不変量か。","resolution":"body","location":"同じ機械、異なる論理"},{"question":"Donaldson理論はsmooth分類を完了するか。","resolution":"body","location":"どこまで分かったか"}],"required_bridges":["一般不変量機械から二つの出力へ","smooth制約から分類照合へ"],"figures":[],"sources":["src-dk","src-donaldson","src-donaldson-poly","src-fintushel-stern"],"previous_connection":"第12章の機械をDonaldson理論の二種類の結論へ適用する。","next_question":"topological分類とsmooth不変量をどう組み合わせて異種対を示すのか。","unresolved_stop_points":[]}
