{"chapter_id":"ch-10","source":"chapters/10-smooth-moduli.qmd","central_question":"expected dimensionを実際の滑らかな次元へ変える条件は何か。","reader_starting_state":"indexがkernelとcokernelの差であり、実次元と異なりうることを理解している。","prerequisites":["not-G","not-M","not-H","conv-dimension"],"new_concepts":[],"main_derivations":["slice上の非線形ASD写像","Kuranishi模型","universal moduliとregular metric"],"results":["thm-slice","thm-asd-complex"],"proof_depth":"C","black_boxes":[],"rigor_statuses":["theorem","proposition"],"reader_stop_points":[{"question":"H_A^2が非零なら局所構造は失われるか。","resolution":"body","location":"非線形方程式をslice上で解く"},{"question":"genericは何を意味するか。","resolution":"body","location":"generic metricは何を動かすのか"}],"required_bridges":["indexからKuranishi模型へ","局所smoothnessからglobal compactnessへ"],"figures":[],"sources":["src-dk","src-fu"],"previous_connection":"第9章のexpected dimensionに全射性とirreducibilityを加える。","next_question":"smoothな解列が収束しないとき何が起きるのか。","unresolved_stop_points":[]}
