{"chapter_id":"ch-08","source":"chapters/08-deformation-complex.qmd","central_question":"方程式と対称性の無限小変化はどう一つの複体になるのか。","reader_starting_state":"gauge orbitの接方向とCoulomb slice条件を計算できる。","prerequisites":["not-A","not-F","not-G","not-M","conv-asd"],"new_concepts":["not-H"],"main_derivations":["ASD方程式の線形化","d_A^+d_A=0","symbol列のexactness"],"results":["thm-asd-complex"],"proof_depth":"B","black_boxes":[],"rigor_statuses":["theorem","proposition"],"reader_stop_points":[{"question":"moduli接空間はなぜkernelそのものではないか。","resolution":"body","location":"接空間は核だけではない"},{"question":"ASD条件は複体性のどこで必要か。","resolution":"body","location":"なぜ本当に複体か"}],"required_bridges":["sliceから無限小商へ","楕円複体からFredholm indexへ"],"figures":[],"sources":["src-dk"],"previous_connection":"第7章の局所商を無限小データへ落とす。","next_question":"楕円性はなぜ有限次元の期待次元を与えるのか。","unresolved_stop_points":[]}
