{"chapter_id":"ch-04","source":"chapters/04-connections-curvature.qmd","central_question":"多様体上の補助場から位相数をどう取り出すのか。","reader_starting_state":"局所座標、微分形式、交点形式、およびDonaldson理論が微分方程式を必要とする理由を理解している。ベクトル束、主束、接続、曲率は未習でよい。","prerequisites":["not-X","not-Q","assump-base"],"new_concepts":["not-A","not-F","conv-inner-product","conv-charge"],"main_derivations":["接続のgauge変換則","曲率とBianchi恒等式","Chern-Weil積分の接続独立性"],"results":[],"proof_depth":"A","black_boxes":[],"rigor_statuses":["definition","proposition"],"reader_stop_points":[{"question":"接続1形式はtensorか。","resolution":"body","location":"微分を束の上へ持ち上げる"},{"question":"曲率積分はなぜ接続に依存しないか。","resolution":"body","location":"局所的な曲率から大域的整数へ"}],"required_bridges":["Donaldsonの解析機械から接続へ","Chern-Weil数から4次元Hodge分解へ"],"figures":["fig-mobius-bundle","fig-rotating-frame","fig-connection-trivialization"],"sources":[],"previous_connection":"第3章で必要になった解析的観測量の局所データを作る。","next_question":"4次元では曲率2形式をどのように分解できるのか。","unresolved_stop_points":[]}
