{"chapter_id":"ch-15","source":"chapters/15-spinors.qmd","central_question":"非可換instantonsとは異なる第二のゲージ理論を何が可能にするのか。","reader_starting_state":"ASD moduli機械の能力とnon-abelian compactnessの難所を理解している。","prerequisites":["not-X","not-bplus","assump-base"],"new_concepts":[],"main_derivations":["Spin^c構造の必要性","Dirac作用素の構成","spinor二次写像と自己双対2形式"],"results":[],"proof_depth":"B","black_boxes":[],"rigor_statuses":["definition","proposition"],"reader_stop_points":[{"question":"SpinでなくSpin^cを使うのはなぜか。","resolution":"body","location":"SpinでなくSpin^cなのはなぜか"},{"question":"U(1)理論は線形か。","resolution":"body","location":"gauge symmetryは可換でも残る"}],"required_bridges":["Donaldson解析の難所からspinorへ","Dirac作用素からSW方程式へ"],"figures":[],"sources":[],"previous_connection":"第14章で求めた第二のsmooth観測機械の未知量を導入する。","next_question":"可換接続とspinorの連成はどのような楕円moduli問題を作るのか。","unresolved_stop_points":[]}
