{"chapter_id":"ch-18","source":"chapters/18-kahler-symplectic.qmd","central_question":"SW不変量は幾何学的構造へどのような具体的制約を返すのか。","reader_starting_state":"Seiberg-Witten不変量の定義域、SW基本類、Donaldson理論との差を理解している。複素多様体、Kähler形式、シンプレクティック形式、擬正則曲線は未習でよい。","prerequisites":["not-X","not-bplus","not-sw-basic","assump-base","assump-invariance"],"new_concepts":["not-adjunction"],"main_derivations":["Kahler面でのspinor型分解","O(d)の貼り合わせと同次多項式の対応","Taubes SWから擬正則曲線への骨格","随伴不等式の意味"],"results":["thm-sw-framework","thm-taubes","thm-adjunction"],"proof_depth":"D","black_boxes":["bb-taubes","bb-adjunction"],"rigor_statuses":["theorem","black_box_theorem"],"reader_stop_points":[{"question":"Taubesの定理はSW解と曲線を同一視するだけか。","resolution":"black_box","location":"Taubesの反転"},{"question":"ゲージ不変量はsmooth構造の識別以外に何を与えるか。","resolution":"body","location":"随伴不等式"}],"required_bridges":["二理論の比較からsymplectic幾何へ","幾何的帰結から中心問題の回答へ"],"figures":["fig-adjunction","fig-kahler-reduction","fig-od-line-bundle-charts","fig-taubes-limit"],"sources":["src-taubes","src-km-adjunction","src-morgan-sw"],"previous_connection":"第17章の比較を具体的なsymplectic出力で完結させる。","next_question":"本教材の中心問題への回答を他の4次元幾何へどう拡張するか。","unresolved_stop_points":[]}
