{"chapter_id":"ch-09","source":"chapters/09-ellipticity-index.qmd","central_question":"無限次元問題から有限の期待次元がなぜ出るのか。","reader_starting_state":"ASD変形複体と各コホモロジーの意味を理解している。","prerequisites":["not-H","not-bplus","conv-dimension"],"new_concepts":["not-index"],"main_derivations":["楕円estimateからFredholm性","ASD index formula","期待次元と実次元の差"],"results":["thm-asd-complex"],"proof_depth":"B","black_boxes":[],"rigor_statuses":["theorem","proposition"],"reader_stop_points":[{"question":"方程式の本数だけで有限次元と言えるか。","resolution":"body","location":"方程式の本数を数えてはいけない"},{"question":"indexは実際の次元か。","resolution":"body","location":"expectedとactualを区別する"}],"required_bridges":["楕円複体からFredholm作用素へ","indexから正則性問題へ"],"figures":[],"sources":["src-dk"],"previous_connection":"第8章のsymbol exactnessを大域的有限次元性へ変える。","next_question":"期待次元をactual smooth dimensionへ変える条件は何か。","unresolved_stop_points":[]}
