{"chapter_id":"ch-02","source":"chapters/02-intersection-form.qmd","central_question":"なぜ4次元ではH2の交点形式が中心になるのか。","reader_starting_state":"smooth structureを不変量で観測する方針を理解している。","prerequisites":["not-X","assump-base"],"new_concepts":["not-Q","not-bplus"],"main_derivations":["横断交点からcup積表示","Poincare dualityからunimodular性","向き反転と連結和の計算"],"results":[],"proof_depth":"A","black_boxes":[],"rigor_statuses":["definition","proposition"],"reader_stop_points":[{"question":"曲面の代表を動かすと交点数は変わらないか。","resolution":"body","location":"曲面を動かしても残る整数"},{"question":"形式が同じなら多様体も同じか。","resolution":"body","location":"注意callout"}],"required_bridges":["smooth観測量から位相的入力へ","整数形式から実現可能性へ"],"figures":["fig-chains-cycles","fig-intersection-sign"],"sources":["src-gompf-stipsicz"],"previous_connection":"第1章の観測問題に位相的な比較基準を与える。","next_question":"位相圏で許される形式は滑らかな圏でも実現するのか。","unresolved_stop_points":[]}
