{"chapter_id":"ch-14","source":"chapters/14-topological-vs-smooth.qmd","central_question":"非平滑化可能性とexotic smooth structureをどう区別するのか。","reader_starting_state":"Freedman分類、Donaldson対角化、多項式不変量の出力を区別できる。","prerequisites":["not-X","not-Q","assump-donaldson"],"new_concepts":[],"main_derivations":["smoothability obstructionの論理","exotic pairの二本の証明","connected sumによる情報消失"],"results":["thm-freedman","thm-donaldson-diagonalization"],"proof_depth":"D","black_boxes":["bb-freedman"],"rigor_statuses":["theorem","black_box_theorem"],"reader_stop_points":[{"question":"非平滑化可能性だけでexotic pairを得るか。","resolution":"body","location":"二種類の否定を分ける"},{"question":"intersection form一致だけでhomeomorphicか。","resolution":"black_box","location":"照合の手順"}],"required_bridges":["Donaldson二出力から分類照合へ","非可換理論の難所からSW理論へ"],"figures":[],"sources":["src-freedman","src-donaldson","src-dk"],"previous_connection":"第13章の出力をtopological分類と論理的に照合する。","next_question":"別のゲージ方程式は同じsmooth情報をより直接に計算できるか。","unresolved_stop_points":[]}
