{"chapter_id":"ch-03","source":"chapters/03-freedman-donaldson.qmd","central_question":"位相的に許される交点形式は滑らかにも実現するのか。","reader_starting_state":"intersection formのunimodular性、符号、evenとoddを区別できる。","prerequisites":["not-X","not-Q","assump-donaldson"],"new_concepts":[],"main_derivations":["FreedmanとDonaldsonの仮定比較","対角化定理の証明アーキテクチャ","E8によるsmoothability obstruction"],"results":["thm-freedman","thm-donaldson-diagonalization"],"proof_depth":"C","black_boxes":["bb-freedman"],"rigor_statuses":["theorem","black_box_theorem"],"reader_stop_points":[{"question":"Freedman分類は形式だけで一意性を与えるか。","resolution":"black_box","location":"Freedman分類callout"},{"question":"非平滑化可能性だけでexotic pairを得るか。","resolution":"body","location":"衝突がまだ教えていないこと"}],"required_bridges":["intersection formから二つの圏の衝突へ","対角化定理からASD解析へ"],"figures":[],"sources":["src-dk","src-freedman","src-donaldson"],"previous_connection":"第2章の形式実現問題をtopologicalとsmoothに分ける。","next_question":"Donaldsonの制約を生む接続と曲率はどう定義されるのか。","unresolved_stop_points":[]}
