{"chapter_id":"ch-17","source":"chapters/17-donaldson-vs-sw.qmd","central_question":"二つの異なるmoduli問題はどこで同じ機械を使いどこで違うのか。","reader_starting_state":"ASDとSWの各moduli構成を方程式からcountまで追跡できる。","prerequisites":["not-M","not-bplus","assump-invariance","assump-wall"],"new_concepts":["not-sw-basic"],"main_derivations":["moduli lifecycleの比較","compactness機構の比較","Witten予想のstatus区別","連結和消滅定理の仮定と用途"],"results":["thm-sw-framework","thm-donaldson-diagonalization"],"proof_depth":"C","black_boxes":[],"rigor_statuses":["theorem","conjecture","physical_intuition"],"reader_stop_points":[{"question":"SWは可換だから線形で簡単か。","resolution":"body","location":"可換だから簡単の限界"},{"question":"二つの不変量は常に同じか。","resolution":"body","location":"両不変量は常に同じか"},{"question":"連結和でSW不変量が消えるのはどの仮定の下か。","resolution":"body","location":"連結和と基本類"}],"required_bridges":["SW moduliから共通機械の比較へ","smooth invariantからsymplectic幾何へ"],"figures":["fig-donaldson-sw"],"sources":["src-witten","src-donaldson","src-morgan-sw"],"previous_connection":"第16章のSW機械を第7--13章のASD機械と段階別に比較する。","next_question":"非零SW不変量は幾何学的構造へ何を強制するのか。","unresolved_stop_points":[]}
