{"chapter_id":"ch-16","source":"chapters/16-seiberg-witten-equations.qmd","central_question":"可換gauge場とspinorの連成はどのようなmoduli問題を作るのか。","reader_starting_state":"Spin^c構造、Dirac作用素、spinor二次写像の型を理解している。","prerequisites":["not-X","not-bplus","assump-invariance","assump-wall"],"new_concepts":[],"main_derivations":["perturbed SW方程式","SW expected dimension","Weitzenbock estimateとcompactness"],"results":["thm-sw-framework"],"proof_depth":"C","black_boxes":[],"rigor_statuses":["theorem","proposition"],"reader_stop_points":[{"question":"SW moduliのactual dimensionは常にindexか。","resolution":"body","location":"線形化とexpected dimension"},{"question":"compactnessはなぜASD側より直接的か。","resolution":"body","location":"Weitzenbock formulaがcompactnessを作る"}],"required_bridges":["spinorの型から連成方程式へ","SW moduliからDonaldson比較へ"],"figures":[],"sources":["src-witten"],"previous_connection":"第15章のDirac作用素と二次写像を一つの方程式系へ組む。","next_question":"SWとDonaldsonはどの段階を共有し、どこで異なるのか。","unresolved_stop_points":[]}
